date,post_type,caption,visual_idea,CTA,metric
2025-09-01,Carousel,"The 5 Branding Mistakes Killing Your Startup (And How to Fix Them)","5 slides with icons and brief text","Save this post & follow for more branding tips",Engagement
2025-09-02,Reel,"Watch us transform this brand in 60 seconds","Screen recording of design process","DM us 'TRANSFORM' for a free brand audit",Views
2025-09-03,Story Poll,"Which logo do you prefer? A or B?","Two logo options side by side","Vote in the poll! Results in 24h 🎉",Engagement
2025-09-04,Static Post,"Why your startup needs more than just a logo","Infographic with key stats","Tag a founder who needs to see this",Reach
2025-09-05,Testimonial,"'Our investment increased by 3x after rebranding with Pulse & Pixel' - [Client]","Client headshot with quote","Book your brand sprint → [Link]",Clicks
2025-09-06,Behind Scenes,"How we use AI to create better brands faster","Team working on a brand project","Comment 'AI' to see how it works",Comments
2025-09-07,Quick Tip,"Your brand colors are sending a message. Are you saying the right thing?","Color psychology breakdown","Save for your next brand project",Saves
DAY 8-30 - fill,fill,fill,fill,fill,fill
