date,post_type,caption,visual_idea,CTA,metric
2025-09-01,Carousel,"The 5 Branding Mistakes Killing Your Startup (And How to Fix Them)","5 slides with icons and brief text","Save this post & follow for more branding tips",Engagement
2025-09-02,Reel,"Watch us transform this brand in 60 seconds","Screen recording of design process","DM us 'TRANSFORM' for a free brand audit",Views
2025-09-03,Story Poll,"Which logo do you prefer? A or B?","Two logo options side by side","Vote in the poll! Results in 24h 🎉",Engagement
2025-09-04,Static Post,"Why your startup needs more than just a logo","Infographic with key stats","Tag a founder who needs to see this",Reach
2025-09-05,Testimonial,"'Our investment increased by 3x after rebranding with Pulse & Pixel' - [Client]","Client headshot with quote","Book your brand sprint → [Link]",Clicks
2025-09-06,Behind Scenes,"How we use AI to create better brands faster","Team working on a brand project","Comment 'AI' to see how it works",Comments
2025-09-07,Quick Tip,"Your brand colors are sending a message. Are you saying the right thing?","Color psychology breakdown","Save for your next brand project",Saves
2025-09-08,Reel,"30s Brand Audit: What to fix first","Quick screen-record before/after with annotations","Book a 15-min audit",Leads
2025-09-09,Static Post,"Meet the founders behind Pulse & Pixel","Founder portrait + short bio","Follow our journey",Reach
2025-09-10,Carousel,"Branding terms every founder should know","5 slides: logo, palette, typography, voice, system","Save & share with your cofounder",Engagement
2025-09-11,Story Q&A,"Ask us anything about branding — we're answering live later","Question sticker; branded background","Send your question now",Replies
2025-09-12,Blog Promo,"New blog: 5 steps to test your logo before launch","Blog cover image + excerpt","Read the full post → [Link]",Clicks
2025-09-13,Template Drop,"Free: Social templates to launch your product","Preview of 3 editable templates","Download the free kit",Downloads
2025-09-14,Case Study,"How a simple redesign increased signups by 40%","Before/after landing mockups + metric","Read full case study",Clicks
2025-09-15,Poll,"Which brand tone fits your product best? Playful or Professional?","Two moodboards side-by-side","Vote in poll",Engagement
2025-09-16,Quick Tip,"Use contrast to guide attention — here's how","Visual example of contrast in CTA/button","Save this tip for later",Saves
2025-09-17,Live Promo,"Going live: Watch a 20-min Brand Sprint","Countdown graphic + date/time","Set a reminder / RSVP",Signups
2025-09-18,Reel,"Live demo highlights — brand sprint recap","Short clips from the live session","Watch the replay",Views
2025-09-19,Carousel,"Top 5 Branding FAQs (answered fast)","5 slides with Q&A","Ask your own question in comments",Comments
2025-09-20,Offer,"Early-bird: 20% off Brand Sprint this week only","Pricing card with limited slots","Claim discount → Book now",Bookings
2025-09-21,UGC,"Show us your logo — feature week #PulseAndPixel","Collage of user-submitted logos","Tag us to be featured",Shares
2025-09-22,Static Post,"A/B test your hero image — simple split-test ideas","Split-screen test examples with result mockups","Try this test and DM results",Clicks
2025-09-23,Quiz,"Which brand archetype are you? (Quick quiz)","Quiz cover + 5-choice cards","Take the quiz → link",Leads
2025-09-24,Portfolio,"Startup spotlight: Full brand kit preview","Portfolio mockup with assets","View more in portfolio",Views
2025-09-25,Workshop Promo,"Join our 2-hour hands-on branding workshop","Workshop flyer with key takeaways","Register now — limited seats",Signups
2025-09-26,Behind Scenes,"How we build scalable color systems","Designer screen + palette exploration","Comment 'palette' for tips",Comments
2025-09-27,Resource Share,"Top 5 free tools every founder should use","Icons + short descriptions","Save & share with founders",Shares
2025-09-28,Countdown,"3 days left to grab the early-bird discount","Countdown timer graphic","Book your spot now",Bookings
2025-09-29,Static Post,"Brand sprint ROI: What you can expect","Infographic with simple math (cost → potential results)","DM for a tailored estimate",Leads
2025-09-30,Wrap-up,"September roundup + last chance for discounted slots","Montage of this month's highlights","Book the final slot",Bookings

